shaper_id,shaper_name,board_name,type,length,fins,description,price
1,Mill Road Shapes,The River Pig,Fish,6'2",FCS II Twin + Trailer,A classic fish shape with a modern twist. Wide point forward for maximum paddle and speed in small surf.,950
1,Mill Road Shapes,The Pocket Knife,Shortboard,6'0",FCS II Thruster,High-performance shortboard designed for punchy beach break. Concave entry with a deep single to double concave through the fins.,1100
2,Southern Glass Co,The Tint Job (Custom Glass),Glassing,Any,,Custom glassing service with a full range of tint colours and resin art options. Price on application.,0
4,Channel Islands,Happy Everyday,Shortboard,6'2",FCS II Thruster,The best-selling everyday shortboard. Works in everything from waist-high to overhead+ surf.,899
4,Channel Islands,Rocket Wide,Shortboard,5'10",FCS II Thruster,Compact and responsive. Designed for surfers who want a shorter board that still paddles and generates speed easily.,879
