shaper_id,shaper_name,topic,icon,summary,display_order
1,Mill Road Shapes,Blank Selection,🪵,We use Australian-sourced Clark-style blanks for all custom orders. The blank choice dramatically affects the final feel — we'll talk you through it before we start shaping.,1
1,Mill Road Shapes,Rocker,📐,Rocker is everything. A flat rocker generates speed in small surf; a staged rocker gives control in bigger waves. Most of our shapes sit somewhere in between.,2
1,Mill Road Shapes,Fin Setups,🦈,We shape for thruster, twin, quad and 2+1 setups. The fin box choice is yours — we run FCS II and Futures as standard.,3
4,Channel Islands,Concave Systems,〰️,Our signature single-to-double concave system is the result of 50 years of refinement. It creates lift through the fins and drives speed down the line.,1
4,Channel Islands,Custom Program,✏️,Every CI board can be ordered custom. Work with one of our team shapers to dial in the exact dimensions and foil for your surfing.,2
